<?xml version="1.0" encoding="UTF-8"?>
<!-- 
  base XML structure for cycling database 
  image of this model: schema/model.drawio.svg 
  ** data Generated by AI Assistant gpt-5 **
 -->
<cyclingDB xmlns:xsi="http://www.w3.org/2001/XMLSchema-instance"
           xsi:noNamespaceSchemaLocation="../schema/model.xsd">
  <destinations>
    <destination id="dest1">
      <name>Pacific Northwest</name>
      <country>United States</country>
      <description>Coastal forests, sea stacks, and seaside towns</description>
    </destination>
    <destination id="dest2">
      <name>Scottish Highlands</name>
      <country>United Kingdom</country>
      <description>Heather-covered hills and historic glens</description>
    </destination>
  </destinations>

  <paths>
    <path id="path1">
      <name>Pacific Coast Cruise</name>
      <distance_km>180.2</distance_km>
      <difficulty>easy</difficulty>
      <destinationRef>dest1</destinationRef>
    </path>
    <path id="path2">
      <name>Highland Glens Loop</name>
      <distance_km>92</distance_km>
      <difficulty>moderate</difficulty>
      <destinationRef>dest2</destinationRef>
    </path>
  </paths>

  <guides>
    <guide id="g1">
      <firstName>Sarah</firstName>
      <lastName>Johnson</lastName>
      <languages><lang>en</lang><lang>es</lang></languages>
    </guide>
    <guide id="g2">
      <firstName>David</firstName>
      <lastName>MacLeod</lastName>
      <languages><lang>en</lang><lang>ga</lang></languages>
    </guide>
  </guides>

  <bikes>
    <bike id="bike1">
      <model>Cannondale Synapse</model>
      <category>endurance road</category>
      <size>M</size>
      <status>available</status>
    </bike>
    <bike id="bike2">
      <model>Specialized Turbo Vado</model>
      <category>e-bike</category>
      <size>L</size>
      <status>maintenance</status>
    </bike>
  </bikes>

  <clients>
    <client id="c1">
      <firstName>Olivia</firstName>
      <lastName>Brooks</lastName>
      <email>olivia.brooks@example.com</email>
    </client>
    <client id="c2">
      <firstName>Mason</firstName>
      <lastName>Reid</lastName>
      <email>mason.reid@example.com</email>
    </client>
  </clients>

  <packages>
    <package id="p1">
      <title>Coastal Redwood Retreat</title>
      <pathRef>path1</pathRef>
      <price currency="USD">449.00</price>
      <startDate>2025-07-15</startDate>
      <endDate>2025-07-18</endDate>
      <guideRef>g1</guideRef>
    </package>
    <package id="p2">
      <title>Highland Heritage Ride</title>
      <pathRef>path2</pathRef>
      <price currency="GBP">599.00</price>
      <startDate>2025-08-05</startDate>
      <endDate>2025-08-08</endDate>
      <guideRef>g2</guideRef>
    </package>
  </packages>

  <bookings>
    <booking id="b1">
      <clientRef>c1</clientRef>
      <packageRef>p1</packageRef>
      <bikeRef>bike1</bikeRef>
      <status>confirmed</status>
    </booking>
    <booking id="b2">
      <clientRef>c2</clientRef>
      <packageRef>p2</packageRef>
      <bikeRef>bike2</bikeRef>
      <status>pending</status>
    </booking>
  </bookings>
</cyclingDB>